Bus 001 Device 002: ID 0fa6:1001  
Device Descriptor:
  bLength                18
  bDescriptorType         1
  bcdUSB               1.0a
  bDeviceClass            0 (Defined at Interface level)
  bDeviceSubClass         0 
  bDeviceProtocol         0 
  bMaxPacketSize0         8
  idVendor           0x0fa6 
  idProduct          0x1001 
  bcdDevice            1.00
  iManufacturer           1 CMD AG
  iProduct                2 CMD USB-Stick
  iSerial                 3 V1.00
  bNumConfigurations      1
  Configuration Descriptor:
    bLength                 9
    bDescriptorType         2
    wTotalLength           34
    bNumInterfaces          1
    bConfigurationValue     1
    iConfiguration          4 Cfg1
    bmAttributes         0x80
    MaxPower              100mA
    Interface Descriptor:
      bLength                 9
      bDescriptorType         4
      bInterfaceNumber        0
      bAlternateSetting       0
      bNumEndpoints           1
      bInterfaceClass         3 Human Interface Devices
      bInterfaceSubClass      0 No Subclass
      bInterfaceProtocol      0 None
      iInterface              5 EP10In
        HID Device Descriptor:
          bLength                 9
          bDescriptorType        33
          bcdHID               1.00
          bCountryCode            0 Not supported
          bNumDescriptors         1
          bDescriptorType        34 Report
          wDescriptorLength      52
         Report Descriptors: 
           ** UNAVAILABLE **
      Endpoint Descriptor:
        bLength                 7
        bDescriptorType         5
        bEndpointAddress     0x81  EP 1 IN
        bmAttributes            3
          Transfer Type            Interrupt
          Synch Type               None
          Usage Type               Data
        wMaxPacketSize     0x0006  1x 6 bytes
        bInterval              10

