
Bus 002 Device 001: ID 0000:0000  
Device Descriptor:
  bLength                18
  bDescriptorType         1
  bcdUSB               1.10
  bDeviceClass            9 Hub
  bDeviceSubClass         0 Unused
  bDeviceProtocol         0 Full speed hub
  bMaxPacketSize0         8
  idVendor           0x0000 
  idProduct          0x0000 
  bcdDevice            2.06
  iManufacturer           3 Linux 2.6.11-1.1369_FC4 uhci_hcd
  iProduct                2 UHCI Host Controller
  iSerial                 1 0000:00:1f.4
  bNumConfigurations      1
  Configuration Descriptor:
    bLength                 9
    bDescriptorType         2
    wTotalLength           25
    bNumInterfaces          1
    bConfigurationValue     1
    iConfiguration          0 
    bmAttributes         0xc0
      Self Powered
    MaxPower                0mA
    Interface Descriptor:
      bLength                 9
      bDescriptorType         4
      bInterfaceNumber        0
      bAlternateSetting       0
      bNumEndpoints           1
      bInterfaceClass         9 Hub
      bInterfaceSubClass      0 Unused
      bInterfaceProtocol      0 Full speed hub
      iInterface              0 
      Endpoint Descriptor:
        bLength                 7
        bDescriptorType         5
        bEndpointAddress     0x81  EP 1 IN
        bmAttributes            3
          Transfer Type            Interrupt
          Synch Type               None
          Usage Type               Data
        wMaxPacketSize     0x0002  1x 2 bytes
        bInterval             255
Hub Descriptor:
  bLength               9
  bDescriptorType      41
  nNbrPorts             2
  wHubCharacteristic 0x000a
    No power switching (usb 1.0)
    Per-port overcurrent protection
  bPwrOn2PwrGood        1 * 2 milli seconds
  bHubContrCurrent      0 milli Ampere
  DeviceRemovable    0x00
  PortPwrCtrlMask    0x00 
 Hub Port Status:
   Port 1: 0000.0100 power
   Port 2: 0000.0100 power

Bus 001 Device 002: ID 0fa6:1001  
Device Descriptor:
  bLength                18
  bDescriptorType         1
  bcdUSB               1.0a
  bDeviceClass            0 (Defined at Interface level)
  bDeviceSubClass         0 
  bDeviceProtocol         0 
  bMaxPacketSize0         8
  idVendor           0x0fa6 
  idProduct          0x1001 
  bcdDevice            1.00
  iManufacturer           1 CMD AG
  iProduct                2 CMD USB-Stick
  iSerial                 3 V1.00
  bNumConfigurations      1
  Configuration Descriptor:
    bLength                 9
    bDescriptorType         2
    wTotalLength           34
    bNumInterfaces          1
    bConfigurationValue     1
    iConfiguration          4 Cfg1
    bmAttributes         0x80
    MaxPower              100mA
    Interface Descriptor:
      bLength                 9
      bDescriptorType         4
      bInterfaceNumber        0
      bAlternateSetting       0
      bNumEndpoints           1
      bInterfaceClass         3 Human Interface Devices
      bInterfaceSubClass      0 No Subclass
      bInterfaceProtocol      0 None
      iInterface              5 EP10In
        HID Device Descriptor:
          bLength                 9
          bDescriptorType        33
          bcdHID               1.00
          bCountryCode            0 Not supported
          bNumDescriptors         1
          bDescriptorType        34 Report
          wDescriptorLength      52
         Report Descriptors: 
           ** UNAVAILABLE **
      Endpoint Descriptor:
        bLength                 7
        bDescriptorType         5
        bEndpointAddress     0x81  EP 1 IN
        bmAttributes            3
          Transfer Type            Interrupt
          Synch Type               None
          Usage Type               Data
        wMaxPacketSize     0x0006  1x 6 bytes
        bInterval              10

Bus 001 Device 001: ID 0000:0000  
Device Descriptor:
  bLength                18
  bDescriptorType         1
  bcdUSB               1.10
  bDeviceClass            9 Hub
  bDeviceSubClass         0 Unused
  bDeviceProtocol         0 Full speed hub
  bMaxPacketSize0         8
  idVendor           0x0000 
  idProduct          0x0000 
  bcdDevice            2.06
  iManufacturer           3 Linux 2.6.11-1.1369_FC4 uhci_hcd
  iProduct                2 UHCI Host Controller
  iSerial                 1 0000:00:1f.2
  bNumConfigurations      1
  Configuration Descriptor:
    bLength                 9
    bDescriptorType         2
    wTotalLength           25
    bNumInterfaces          1
    bConfigurationValue     1
    iConfiguration          0 
    bmAttributes         0xc0
      Self Powered
    MaxPower                0mA
    Interface Descriptor:
      bLength                 9
      bDescriptorType         4
      bInterfaceNumber        0
      bAlternateSetting       0
      bNumEndpoints           1
      bInterfaceClass         9 Hub
      bInterfaceSubClass      0 Unused
      bInterfaceProtocol      0 Full speed hub
      iInterface              0 
      Endpoint Descriptor:
        bLength                 7
        bDescriptorType         5
        bEndpointAddress     0x81  EP 1 IN
        bmAttributes            3
          Transfer Type            Interrupt
          Synch Type               None
          Usage Type               Data
        wMaxPacketSize     0x0002  1x 2 bytes
        bInterval             255
Hub Descriptor:
  bLength               9
  bDescriptorType      41
  nNbrPorts             2
  wHubCharacteristic 0x000a
    No power switching (usb 1.0)
    Per-port overcurrent protection
  bPwrOn2PwrGood        1 * 2 milli seconds
  bHubContrCurrent      0 milli Ampere
  DeviceRemovable    0x00
  PortPwrCtrlMask    0x31 
 Hub Port Status:
   Port 1: 0000.0303 lowspeed power enable connect
   Port 2: 0000.0100 power
