
T:  Bus=02 Lev=00 Prnt=00 Port=00 Cnt=00 Dev#=  1 Spd=12  MxCh= 2
B:  Alloc=  0/900 us ( 0%), #Int=  0, #Iso=  0
D:  Ver= 1.10 Cls=09(hub  ) Sub=00 Prot=00 MxPS= 8 #Cfgs=  1
P:  Vendor=0000 ProdID=0000 Rev= 2.06
S:  Manufacturer=Linux 2.6.11-1.1369_FC4 uhci_hcd
S:  Product=UHCI Host Controller
S:  SerialNumber=0000:00:1f.4
C:* #Ifs= 1 Cfg#= 1 Atr=c0 MxPwr=  0mA
I:  If#= 0 Alt= 0 #EPs= 1 Cls=09(hub  ) Sub=00 Prot=00 Driver=hub
E:  Ad=81(I) Atr=03(Int.) MxPS=   2 Ivl=255ms

T:  Bus=01 Lev=00 Prnt=00 Port=00 Cnt=00 Dev#=  1 Spd=12  MxCh= 2
B:  Alloc=  0/900 us ( 0%), #Int=  0, #Iso=  0
D:  Ver= 1.10 Cls=09(hub  ) Sub=00 Prot=00 MxPS= 8 #Cfgs=  1
P:  Vendor=0000 ProdID=0000 Rev= 2.06
S:  Manufacturer=Linux 2.6.11-1.1369_FC4 uhci_hcd
S:  Product=UHCI Host Controller
S:  SerialNumber=0000:00:1f.2
C:* #Ifs= 1 Cfg#= 1 Atr=c0 MxPwr=  0mA
I:  If#= 0 Alt= 0 #EPs= 1 Cls=09(hub  ) Sub=00 Prot=00 Driver=hub
E:  Ad=81(I) Atr=03(Int.) MxPS=   2 Ivl=255ms

T:  Bus=01 Lev=01 Prnt=01 Port=00 Cnt=01 Dev#=  3 Spd=1.5 MxCh= 0
D:  Ver= 1.0a Cls=00(>ifc ) Sub=00 Prot=00 MxPS= 8 #Cfgs=  1
P:  Vendor=0fa6 ProdID=1001 Rev= 1.00
S:  Manufacturer=CMD AG
S:  Product=CMD USB-Stick
S:  SerialNumber=V1.00
C:* #Ifs= 1 Cfg#= 1 Atr=80 MxPwr=100mA
I:  If#= 0 Alt= 0 #EPs= 1 Cls=03(HID  ) Sub=00 Prot=00 Driver=usbhid
E:  Ad=81(I) Atr=03(Int.) MxPS=   6 Ivl=10ms
